{
  "event_id": "evt_20260528_083536109Z_ops-0052_backlog",
  "schema_version": "rook-hermes-event.v1",
  "source_system": "dashboard",
  "target_system": "rook",
  "event_type": "task_state.changed",
  "task_id": "ops-0052",
  "correlation_id": "corr_ops-0052_20260528_083536109Z",
  "idempotency_key": "task_state.changed:ops-0052:intake:backlog:2026-05-28T08:35:35.934Z",
  "classification": "ops-internal",
  "created_at": "2026-05-28T08:35:36.109Z",
  "ttl_hours": 168,
  "payload": {
    "status_before": "intake",
    "status_after": "backlog",
    "project_id": "rook-workspace",
    "title": "EVENT LEDGER SMOKE TEST 2026-05-28",
    "related_repo": "MarcusGraetsch/rook-workspace",
    "assigned_agent": "rook",
    "workflow_stage": "kanban-sync",
    "priority": "low",
    "summary": "Kanban task moved from intake to backlog.",
    "task_path": "tasks/rook-workspace/ops-0052.json",
    "artifacts": [],
    "commits": []
  },
  "acks": [],
  "delivery": {
    "state": "pending",
    "attempts": 0,
    "next_attempt_at": "2026-05-28T08:35:36.109Z"
  }
}
